{
  "$defs": {
    "ConfidenceBand": {
      "description": "The band, not the number, is what drives behaviour and what a reader sees.",
      "enum": [
        "high",
        "medium",
        "low"
      ],
      "title": "ConfidenceBand",
      "type": "string"
    },
    "LabelTag": {
      "description": "Why, in one closed word.\n\nEvery tag names a defect with a **different** fix. Two tags that lead to the\nsame code change would be one tag. Three of these deliberately mirror a\ncounterweight the pipeline already computes, which buys that counterweight's\nown precision and recall out of the same 60 labels.\n\nAbsent on purpose: severity, which is a second axis with its own agreement\nproblem; anything about style, which is not faithfulness; and `other`, which\ngrows until the vocabulary means nothing. `note` carries the misses.",
      "enum": [
        "none",
        "invented_fact",
        "wrong_number",
        "overstated",
        "wrong_subject",
        "not_the_article",
        "unjudgeable"
      ],
      "title": "LabelTag",
      "type": "string"
    },
    "LabelVerdict": {
      "description": "The one question. Not a bool - a bool named `unsupported` inverts in\nsomebody's head within a month.",
      "enum": [
        "supported",
        "unsupported"
      ],
      "title": "LabelVerdict",
      "type": "string"
    }
  },
  "$id": "label-row.schema.json",
  "$schema": "https://json-schema.org/draft/2020-12/schema",
  "additionalProperties": false,
  "changelog": [
    {
      "change": "Removed pipeline_fingerprint. BREAKING, and no read-side migration is owed.",
      "version": "2026-09-13T22:00",
      "why": "It was the covariate a draw reported per stratum, and the stamp stopped being written on 2026-09-12. No row is migrated because none exists: state/labels.csv has never been written, which is the same reason the two entries below it migrate nothing either."
    },
    {
      "change": "pipeline_fingerprint is optional and nothing sets it.",
      "version": "2026-09-12T21:00",
      "why": "A draw reported the stamp per stratum and refused to call a mixed pool a calibration. The stamp stopped being written, so there is one pool at one scorer and the number is read rather than withheld."
    },
    {
      "change": "Added unsupported_numbers, hedge_dropped and extraction_suspect, nullable, at the end of the row, and from_csv_row as the read side.",
      "version": "2026-09-03",
      "why": "The read side re-joined these three from state/scores.csv on output_digest, and that ledger now keeps only observability.scores_full_grain_months months of item-level rows. A label whose month has been archived would keep its verdict and lose the three counterweights its own tag vocabulary mirrors - wrong_number against unsupported_numbers, overstated against hedge_dropped, not_the_article against extraction_suspect - which is the precision and recall the sixty labels are drawn to buy. Copied onto the row so the label is self-contained before its source can expire. Null and not a value on a row written before this stamp: null says re-join from the ledger while the month is still there, and False would say the counterweight was read and did not fire. No row is migrated because none exists - state/labels.csv has never been written. Appended at the end for the reason the eval ledger appends: a column inserted mid-row shifts every later cell one place under a reader that maps by position."
    },
    {
      "change": "source_word_count is now source_seen_word_count.",
      "version": "2026-08-27",
      "why": "The queue filled it from the eval ledger's source_word_count, which now means the whole article and is null when that length was never recorded. A labeller cannot check a number against text nobody kept. The premise they read is the truncated text, so the count beside it is the count of that text, and it is never missing. No row is migrated because no label has ever been written - state/labels.csv does not exist."
    },
    {
      "change": "Initial shape: the draw's identity, the scorer at draw time, and the label.",
      "version": "2026-08-24",
      "why": "The faithfulness cuts are a reader-facing promise with no measured error rate behind them. Nothing can move a threshold until labels exist, and labels cannot exist until the shape that holds them does (Guardrail #3). Contracts before logic, and this one lands before a single row."
    }
  ],
  "description": "One labelled item, appended by a human.",
  "properties": {
    "band_at_label": {
      "$ref": "#/$defs/ConfidenceBand"
    },
    "date": {
      "pattern": "^\\d{4}-\\d{2}-\\d{2}$",
      "title": "Date",
      "type": "string"
    },
    "draw_id": {
      "description": "Which draw this row belongs to. Distinguishes a second draw from a re-label of the first.",
      "pattern": "^[a-z0-9]+(?:-[a-z0-9]+)*$",
      "title": "Draw Id",
      "type": "string"
    },
    "extraction_suspect": {
      "anyOf": [
        {
          "type": "boolean"
        },
        {
          "type": "null"
        }
      ],
      "default": null,
      "description": "The text the scorer read looked like page furniture. What the not_the_article tag is measured against. Null means unrecorded, never False.",
      "title": "Extraction Suspect"
    },
    "hedge_dropped": {
      "anyOf": [
        {
          "type": "boolean"
        },
        {
          "type": "null"
        }
      ],
      "default": null,
      "description": "The article hedged and the summary asserted, as the scorer read it at draw time. What the overstated tag is measured against. Null means unrecorded, never False.",
      "title": "Hedge Dropped"
    },
    "hhem_at_label": {
      "maximum": 1.0,
      "minimum": 0.0,
      "title": "Hhem At Label",
      "type": "number"
    },
    "label_id": {
      "description": "Deterministic draw key, rebuilt from its value fields on read and never trusted from the file.",
      "pattern": "^[a-z0-9]+(?:-[a-z0-9]+)*$",
      "title": "Label Id",
      "type": "string"
    },
    "labelled_at": {
      "pattern": "^\\d{4}-\\d{2}-\\d{2}T\\d{2}:\\d{2}:\\d{2}Z$",
      "title": "Labelled At",
      "type": "string"
    },
    "labeller": {
      "description": "Who. Checked against evaluation.labellers. Two people disagreeing is signal; an anonymous ledger cannot see it.",
      "pattern": "^[a-z0-9]+(?:-[a-z0-9]+)*$",
      "title": "Labeller",
      "type": "string"
    },
    "note": {
      "anyOf": [
        {
          "maxLength": 500,
          "minLength": 1,
          "type": "string"
        },
        {
          "type": "null"
        }
      ],
      "default": null,
      "description": "Capped and sanitized. If notes pile onto one tag, the vocabulary is wrong.",
      "title": "Note"
    },
    "output_digest": {
      "description": "The exact summary that was judged. The load-bearing field: a mismatch means the label is about different words.",
      "pattern": "^[0-9a-f]{64}$",
      "title": "Output Digest",
      "type": "string"
    },
    "run_id": {
      "pattern": "^\\d{4}-\\d{2}-\\d{2}-[0-9]+$",
      "title": "Run Id",
      "type": "string"
    },
    "scorer_version": {
      "description": "The full string, band values included. Recorded so an analysis can refuse to mix instruments, hidden so it cannot anchor the labeller.",
      "minLength": 1,
      "title": "Scorer Version",
      "type": "string"
    },
    "seconds_spent": {
      "description": "How long this row took. The cheapest fatigue detector there is, and half of what makes a machine-paced dump detectable.",
      "minimum": 1,
      "title": "Seconds Spent",
      "type": "integer"
    },
    "source_seen_word_count": {
      "description": "Words in the premise the labeller reads - the article after sanitizing and truncation, which is what the scorer read too. Not the whole article: that length is null on a ledger row that never recorded it, and a labeller cannot check a number against text nobody kept.",
      "minimum": 0,
      "title": "Source Seen Word Count",
      "type": "integer"
    },
    "source_url": {
      "maxLength": 2048,
      "pattern": "^https?://[^\\s\\\"'<>\\\\]+$",
      "title": "Source Url",
      "type": "string"
    },
    "summary_word_count": {
      "minimum": 0,
      "title": "Summary Word Count",
      "type": "integer"
    },
    "tag": {
      "$ref": "#/$defs/LabelTag"
    },
    "unsupported_numbers": {
      "anyOf": [
        {
          "minimum": 0,
          "type": "integer"
        },
        {
          "type": "null"
        }
      ],
      "default": null,
      "description": "Numbers the summary asserted that appear nowhere in the article, as the scorer counted them at draw time. What the wrong_number tag is measured against. Null on a row written before 2026-09-03, which means re-join it from state/scores/ while that month is still at full grain - it does not mean zero.",
      "title": "Unsupported Numbers"
    },
    "url_key": {
      "pattern": "^[0-9a-f]{64}$",
      "title": "Url Key",
      "type": "string"
    },
    "verdict": {
      "$ref": "#/$defs/LabelVerdict"
    },
    "version": {
      "default": "2026-09-13T22:00",
      "pattern": "^\\d{4}-\\d{2}-\\d{2}(?:T\\d{2}:\\d{2}(?::\\d{2})?)?$",
      "title": "Version",
      "type": "string"
    }
  },
  "required": [
    "label_id",
    "draw_id",
    "url_key",
    "source_url",
    "date",
    "run_id",
    "output_digest",
    "summary_word_count",
    "source_seen_word_count",
    "scorer_version",
    "hhem_at_label",
    "band_at_label",
    "verdict",
    "tag",
    "labeller",
    "labelled_at",
    "seconds_spent"
  ],
  "title": "LabelRow",
  "type": "object",
  "version": "2026-09-13T22:00"
}
